{"version":"1.0","ds_m":10.0,"n":501,"length_m":5000.0,"type":"open","lat":[45.09,45.0900634,45.0901266,45.0901895,45.0902523,45.0903148,45.090377,45.0904389,45.0905006,45.090562,45.0906232,45.090684,45.0907445,45.0908047,45.0908645,45.090924,45.0909832,45.0910421,45.0911005,45.0911587,45.0912164,45.0912738,45.0913308,45.0913875,45.0914437,45.0914996,45.0915551,45.0916101,45.0916648,45.0917192,45.0917731,45.0918266,45.0918797,45.0919324,45.0919847,45.0920367,45.0920882,45.0921394,45.0921901,45.0922405,45.0922905,45.0923401,45.0923893,45.0924382,45.0924867,45.0925348,45.0925826,45.09263,45.092677,45.0927237,45.0927701,45.0928161,45.0928618,45.0929072,45.0929522,45.0929969,45.0930413,45.0930854,45.0931292,45.0931727,45.0932159,45.0932589,45.0933015,45.0933439,45.0933859,45.0934278,45.0934693,45.0935106,45.0935516,45.0935924,45.093633,45.0936732,45.0937133,45.0937531,45.0937926,45.0938319,45.093871,45.0939098,45.0939484,45.0939867,45.0940248,45.0940627,45.0941003,45.0941377,45.0941748,45.0942117,45.0942483,45.0942847,45.0943208,45.0943566,45.0943922,45.0944275,45.0944625,45.0944972,45.0945316,45.0945657,45.0945996,45.0946331,45.0946662,45.0946991,45.0947316,45.0947637,45.0947955,45.0948269,45.0948579,45.0948885,45.0949188,45.0949486,45.0949779,45.0950069,45.0950354,45.0950634,45.0950909,45.095118,45.0951445,45.0951706,45.0951961,45.095221,45.0952454,45.0952693,45.0952926,45.0953152,45.0953373,45.0953587,45.0953796,45.0953997,45.0954193,45.0954381,45.0954563,45.0954738,45.0954905,45.0955066,45.095522,45.0955366,45.0955504,45.0955635,45.0955759,45.0955875,45.0955983,45.0956083,45.0956175,45.0956259,45.0956335,45.0956404,45.0956464,45.0956515,45.0956559,45.0956594,45.0956621,45.095664,45.0956651,45.0956653,45.0956648,45.0956634,45.0956611,45.0956581,45.0956543,45.0956496,45.0956442,45.0956379,45.0956309,45.0956231,45.0956146,45.0956052,45.0955952,45.0955844,45.0955728,45.0955606,45.0955477,45.095534,45.0955197,45.0955048,45.0954892,45.0954729,45.0954561,45.0954393,45.0954224,45.0954056,45.0953888,45.0953719,45.0953551,45.0953383,45.0953214,45.0953046,45.0952877,45.0952709,45.0952541,45.0952372,45.0952204,45.0952036,45.0951867,45.0951699,45.095153,45.0951362,45.0951194,45.0951025,45.0950857,45.0950689,45.095052,45.0950352,45.0950184,45.0950015,45.0949847,45.0949678,45.094951,45.0949342,45.0949173,45.0949005,45.0948837,45.0948668,45.09485,45.0948332,45.0948163,45.0947995,45.0947826,45.0947658,45.094749,45.0947321,45.0946973,45.094646,45.0945804,45.0945035,45.0944186,45.0943294,45.0942398,45.0941537,45.0940748,45.0940068,45.0939524,45.0939141,45.0938935,45.0938916,45.0939084,45.0939253,45.0939421,45.093959,45.0939758,45.0939926,45.0940095,45.0940263,45.0940431,45.09406,45.0940768,45.0940937,45.0941105,45.0941273,45.0941442,45.094161,45.0941778,45.0941947,45.0942115,45.0942283,45.0942452,45.094262,45.0942789,45.0942957,45.0943125,45.0943294,45.0943462,45.094363,45.0943799,45.0943967,45.0944136,45.0944304,45.0944472,45.0944641,45.0944809,45.0944977,45.0944958,45.0944753,45.094437,45.0943826,45.0943145,45.0942357,45.0941496,45.09406,45.0939708,45.0938858,45.0938089,45.0937434,45.0936921,45.0936572,45.0936404,45.0936235,45.0936067,45.0935899,45.093573,45.0935562,45.0935394,45.0935225,45.0935057,45.0934888,45.093472,45.0934552,45.0934383,45.0934215,45.0934047,45.0933878,45.093371,45.0933542,45.0933373,45.0933205,45.0933036,45.0932868,45.09327,45.0932531,45.0932363,45.0932195,45.0932026,45.0931858,45.093169,45.0931521,45.0931353,45.0931184,45.0931016,45.0930848,45.0930679,45.0930511,45.0930343,45.0930174,45.0930006,45.0929837,45.0929669,45.0929501,45.0929332,45.0929164,45.0929,45.0928841,45.0928687,45.0928538,45.0928394,45.0928255,45.0928121,45.0927993,45.0927871,45.0927754,45.0927643,45.0927539,45.092744,45.0927348,45.0927262,45.0927182,45.092711,45.0927044,45.0926985,45.0926933,45.0926888,45.0926851,45.092682,45.0926798,45.0926783,45.0926775,45.0926775,45.0926783,45.0926799,45.0926823,45.0926855,45.0926895,45.0926943,45.0926999,45.0927063,45.0927136,45.0927217,45.0927307,45.0927404,45.092751,45.0927625,45.0927747,45.0927878,45.0928018,45.0928165,45.0928321,45.0928485,45.0928657,45.0928837,45.0929025,45.0929221,45.0929425,45.0929636,45.0929855,45.0930082,45.0930316,45.0930557,45.0930806,45.0931062,45.0931324,45.0931594,45.093187,45.0932153,45.0932441,45.0932737,45.0933038,45.0933345,45.0933657,45.0933976,45.0934299,45.0934628,45.0934962,45.09353,45.0935643,45.0935991,45.0936342,45.0936698,45.0937058,45.0937421,45.0937787,45.0938157,45.093853,45.0938906,45.0939284,45.0939665,45.0940047,45.0940432,45.0940819,45.0941207,45.0941597,45.0941988,45.094238,45.0942773,45.0943167,45.0943561,45.0943955,45.0944349,45.0944743,45.0945137,45.094553,45.0945923,45.0946315,45.0946706,45.0947096,45.0947484,45.0947871,45.0948257,45.094864,45.0949022,45.0949401,45.0949778,45.0950153,45.0950525,45.0950895,45.0951262,45.0951626,45.0951987,45.0952345,45.09527,45.0953052,45.09534,45.0953744,45.0954085,45.0954423,45.0954756,45.0955086,45.0955412,45.0955734,45.0956052,45.0956366,45.0956676,45.0956982,45.0957284,45.0957582,45.0957875,45.0958164,45.095845,45.0958731,45.0959007,45.095928,45.0959548,45.0959812,45.0960072,45.0960328,45.096058,45.0960828,45.0961071,45.0961311,45.0961547,45.0961779,45.0962006,45.096223,45.0962451,45.0962667,45.096288,45.0963089,45.0963295,45.0963497,45.0963696,45.0963891,45.0964083,45.0964272,45.0964457,45.096464,45.0964819,45.0964995,45.0965168,45.0965339,45.0965506,45.0965671,45.0965832,45.0965992,45.0966148,45.0966302,45.0966453],"lon":[6.06,6.0600904,6.060181,6.060272,6.0603632,6.0604549,6.0605468,6.0606391,6.0607318,6.0608249,6.0609183,6.0610122,6.0611064,6.0612011,6.0612961,6.0613916,6.0614876,6.0615839,6.0616807,6.0617779,6.0618755,6.0619736,6.0620721,6.0621711,6.0622704,6.0623703,6.0624705,6.0625712,6.0626723,6.0627739,6.0628758,6.0629782,6.063081,6.0631842,6.0632878,6.0633918,6.0634962,6.0636009,6.0637061,6.0638116,6.0639175,6.0640237,6.0641303,6.0642373,6.0643446,6.0644522,6.0645601,6.0646684,6.0647769,6.0648858,6.0649949,6.0651044,6.0652141,6.0653241,6.0654344,6.0655449,6.0656556,6.0657667,6.0658779,6.0659894,6.0661011,6.0662131,6.0663252,6.0664376,6.0665502,6.0666629,6.0667759,6.0668891,6.0670024,6.0671159,6.0672297,6.0673436,6.0674576,6.0675719,6.0676863,6.0678008,6.0679156,6.0680305,6.0681455,6.0682608,6.0683762,6.0684917,6.0686074,6.0687233,6.0688393,6.0689555,6.0690718,6.0691883,6.069305,6.0694218,6.0695388,6.069656,6.0697733,6.0698908,6.0700085,6.0701264,6.0702444,6.0703626,6.070481,6.0705996,6.0707184,6.0708374,6.0709565,6.0710759,6.0711954,6.0713152,6.0714352,6.0715554,6.0716758,6.0717964,6.0719172,6.0720383,6.0721595,6.072281,6.0724027,6.0725246,6.0726468,6.0727692,6.0728918,6.0730146,6.0731376,6.0732609,6.0733844,6.0735081,6.073632,6.0737562,6.0738805,6.0740051,6.0741298,6.0742548,6.0743799,6.0745052,6.0746308,6.0747565,6.0748823,6.0750083,6.0751345,6.0752608,6.0753873,6.0755139,6.0756406,6.0757674,6.0758944,6.0760214,6.0761485,6.0762756,6.0764029,6.0765302,6.0766575,6.0767848,6.0769122,6.0770396,6.077167,6.0772943,6.0774217,6.077549,6.0776763,6.0778035,6.0779306,6.0780577,6.0781847,6.0783116,6.0784384,6.0785651,6.0786917,6.0788182,6.0789445,6.0790707,6.0791967,6.0793227,6.0794484,6.079574,6.0796995,6.0798248,6.0799499,6.080075,6.0802002,6.0803253,6.0804504,6.0805756,6.0807007,6.0808258,6.080951,6.0810761,6.0812012,6.0813264,6.0814515,6.0815766,6.0817017,6.0818269,6.081952,6.0820771,6.0822023,6.0823274,6.0824525,6.0825777,6.0827028,6.0828279,6.0829531,6.0830782,6.0832033,6.0833284,6.0834536,6.0835787,6.0837038,6.083829,6.0839541,6.0840792,6.0842044,6.0843295,6.0844546,6.0845798,6.0847049,6.08483,6.0849552,6.0850803,6.0852054,6.0853305,6.085448,6.0855526,6.0856398,6.0857058,6.0857477,6.0857637,6.0857531,6.0857163,6.0856549,6.0855717,6.0854703,6.085355,6.085231,6.0851036,6.0849785,6.0848534,6.0847283,6.0846031,6.084478,6.0843529,6.0842277,6.0841026,6.0839775,6.0838523,6.0837272,6.0836021,6.0834769,6.0833518,6.0832267,6.0831015,6.0829764,6.0828513,6.0827262,6.082601,6.0824759,6.0823508,6.0822256,6.0821005,6.0819754,6.0818502,6.0817251,6.0816,6.0814748,6.0813497,6.0812246,6.0810994,6.0809743,6.0808492,6.0807241,6.0805989,6.0804716,6.0803476,6.0802323,6.0801309,6.0800476,6.0799863,6.0799495,6.0799389,6.0799548,6.0799968,6.0800628,6.08015,6.0802546,6.080372,6.0804972,6.0806223,6.0807474,6.0808725,6.0809977,6.0811228,6.0812479,6.0813731,6.0814982,6.0816233,6.0817485,6.0818736,6.0819987,6.0821239,6.082249,6.0823741,6.0824993,6.0826244,6.0827495,6.0828746,6.0829998,6.0831249,6.08325,6.0833752,6.0835003,6.0836254,6.0837506,6.0838757,6.0840008,6.084126,6.0842511,6.0843762,6.0845014,6.0846265,6.0847516,6.0848767,6.0850019,6.085127,6.0852521,6.0853773,6.0855024,6.0856275,6.0857527,6.0858778,6.0860031,6.0861284,6.0862539,6.0863795,6.0865053,6.0866311,6.0867571,6.0868832,6.0870094,6.0871357,6.0872621,6.0873886,6.0875152,6.087642,6.0877688,6.0878956,6.0880226,6.0881497,6.0882768,6.0884039,6.0885312,6.0886584,6.0887857,6.0889131,6.0890404,6.0891678,6.0892952,6.0894226,6.08955,6.0896773,6.0898046,6.0899319,6.0900591,6.0901862,6.0903132,6.0904402,6.0905671,6.0906938,6.0908205,6.090947,6.0910733,6.0911995,6.0913255,6.0914514,6.091577,6.0917025,6.0918277,6.0919528,6.0920776,6.0922021,6.0923265,6.0924505,6.0925743,6.0926979,6.0928212,6.0929441,6.0930669,6.0931893,6.0933114,6.0934332,6.0935548,6.093676,6.0937969,6.0939176,6.0940379,6.0941579,6.0942776,6.0943971,6.0945162,6.0946351,6.0947536,6.0948719,6.09499,6.0951077,6.0952252,6.0953424,6.0954594,6.0955762,6.0956927,6.095809,6.0959252,6.0960411,6.0961568,6.0962724,6.0963878,6.0965031,6.0966182,6.0967332,6.0968481,6.0969629,6.0970776,6.0971922,6.0973068,6.0974214,6.0975359,6.0976504,6.0977649,6.0978794,6.0979939,6.0981084,6.098223,6.0983377,6.0984524,6.0985672,6.0986821,6.0987971,6.0989122,6.0990274,6.0991427,6.0992582,6.0993739,6.0994897,6.0996056,6.0997217,6.099838,6.0999545,6.1000712,6.100188,6.1003051,6.1004223,6.1005398,6.1006574,6.1007753,6.1008934,6.1010117,6.1011302,